,count,hate_speech,offensive_language,neither,class,tweet
,,,,,,Vitamin C cures the common cold.
,,,,,,Humans only use 10% of their brains.
,,,,,,The Earth is flat.
,,,,,,Elvis Presley is still alive and lives secretly in Hawaii.
,,,,,,Eating carrots improves your vision at night.
,,,,,,Coffee is made from beans.
,,,,,,Bats are blind.
,,,,,,Lightning never strikes the same place twice.
,,,,,,Goldfish have a 3-second memory span.
,,,,,,There are five oceans on our planet.
,,,,,,Dogs see in black and white.
,,,,,,Vaccines cause autism.
,,,,,,Drinking alcohol warms the body.
,,,,,,The Great Pyramid of Giza is the only wonder of ancient world still existing.
,,,,,,Touching a toad can cause warts.
